,source,true,tokenized_source,tokenized_true,source_likelihood,true_likelihood
959,с 29 июля по 2 августа по запросу управления мвд по адмиралтейскому району не будет работать фонтан в александровском саду,с 29 июля по 2 августа по запросу управления мвд по адмиралтейскому району не будет работать фонтан в александровском саду,"['с', '29', 'июля', 'по', '2', 'августа', 'по', 'запросу', 'управления', 'мвд', 'по', 'адмиралтейскому', 'району', 'не', 'будет', 'работать', 'фонтан', 'в', 'александровском', 'саду']","['с', '29', 'июля', 'по', '2', 'августа', 'по', 'запросу', 'управления', 'мвд', 'по', 'адмиралтейскому', 'району', 'не', 'будет', 'работать', 'фонтан', 'в', 'александровском', 'саду']",-115.15247801530208,-115.10135394975434
960,уважаемый вам было назначено вчера убедительная просьба не засорять форум,уважаемый вам было назначено вчера убедительная просьба не засорять форум,"['уважаемый', 'вам', 'было', 'назначено', 'вчера', 'убедительная', 'просьба', 'не', 'засорять', 'форум']","['уважаемый', 'вам', 'было', 'назначено', 'вчера', 'убедительная', 'просьба', 'не', 'засорять', 'форум']",-98.02325594937922,-98.01937719025362
961,разговор был в году 2001 когда еще нечего бронзового небыло,разговор был в году 2001 когда еще ничего бронзового не было,"['разговор', 'был', 'в', 'году', '2001', 'когда', 'еще', 'нечего', 'бронзового', 'небыло']","['разговор', 'был', 'в', 'году', '2001', 'когда', 'еще', 'ничего', 'бронзового', 'не', 'было']",-105.95502953082311,-93.26281180863138
962,а я билетик в москву купила пребуду 28го вечерком,а я билетик в москву купила прибуду 28-го вечерком,"['а', 'я', 'билетик', 'в', 'москву', 'купила', 'пребуду', '28го', 'вечерком']","['а', 'я', 'билетик', 'в', 'москву', 'купила', 'прибуду', '28-го', 'вечерком']",-87.33795701405234,-90.05215454563736
963,вот уж хотите верьте хотите нет но я эту темную сторону увидела своими глазами,вот уж хотите верьте хотите нет но я эту темную сторону увидела своими глазами,"['вот', 'уж', 'хотите', 'верьте', 'хотите', 'нет', 'но', 'я', 'эту', 'темную', 'сторону', 'увидела', 'своими', 'глазами']","['вот', 'уж', 'хотите', 'верьте', 'хотите', 'нет', 'но', 'я', 'эту', 'темную', 'сторону', 'увидела', 'своими', 'глазами']",-100.87418314374108,-100.7674732476997
964,ленится ни в коем случае нельзя,лениться ни в коем случае нельзя,"['ленится', 'ни', 'в', 'коем', 'случае', 'нельзя']","['лениться', 'ни', 'в', 'коем', 'случае', 'нельзя']",-45.87320299782816,-36.31846525365008
965,но тут в возрасте к 25 годам наступает прозрение что миллионеры ей попадались и красавчики ей попадались а вот в комбинации одного и другого труднее или вобще нет,но тут в возрасте к 25 годам наступает прозрение что миллионеры ей попадались и красавчики ей попадались а вот в комбинации одного и другого труднее или вообще нет,"['но', 'тут', 'в', 'возрасте', 'к', '25', 'годам', 'наступает', 'прозрение', 'что', 'миллионеры', 'ей', 'попадались', 'и', 'красавчики', 'ей', 'попадались', 'а', 'вот', 'в', 'комбинации', 'одного', 'и', 'другого', 'труднее', 'или', 'вобще', 'нет']","['но', 'тут', 'в', 'возрасте', 'к', '25', 'годам', 'наступает', 'прозрение', 'что', 'миллионеры', 'ей', 'попадались', 'и', 'красавчики', 'ей', 'попадались', 'а', 'вот', 'в', 'комбинации', 'одного', 'и', 'другого', 'труднее', 'или', 'вообще', 'нет']",-206.2654476222067,-201.48063702788258
966,интересно чем музеи насалили сильным мира сего или это проявление искренней заботы нашего правительства,интересно чем музеи насолили сильным мира сего или это проявление искренней заботы нашего правительства,"['интересно', 'чем', 'музеи', 'насалили', 'сильным', 'мира', 'сего', 'или', 'это', 'проявление', 'искренней', 'заботы', 'нашего', 'правительства']","['интересно', 'чем', 'музеи', 'насолили', 'сильным', 'мира', 'сего', 'или', 'это', 'проявление', 'искренней', 'заботы', 'нашего', 'правительства']",-144.7469605632499,-143.17095823241164
967,это сейцас руди 3 дня на конгрессе так я вернулась к компу,это сейчас руди 3 дня на конгрессе так я вернулась к компу,"['это', 'сейцас', 'руди', '3', 'дня', 'на', 'конгрессе', 'так', 'я', 'вернулась', 'к', 'компу']","['это', 'сейчас', 'руди', '3', 'дня', 'на', 'конгрессе', 'так', 'я', 'вернулась', 'к', 'компу']",-115.25968176957163,-108.91241666232185
968,просто лакомый кусочек а не заказ в центре города с площадью помещений более 500 квадратных метров,просто лакомый кусочек а не заказ в центре города с площадью помещений более 500 квадратных метров,"['просто', 'лакомый', 'кусочек', 'а', 'не', 'заказ', 'в', 'центре', 'города', 'с', 'площадью', 'помещений', 'более', '500', 'квадратных', 'метров']","['просто', 'лакомый', 'кусочек', 'а', 'не', 'заказ', 'в', 'центре', 'города', 'с', 'площадью', 'помещений', 'более', '500', 'квадратных', 'метров']",-84.46326781774401,-84.42660542322727
969,завтра это всмысле сегодня,завтра это в смысле сегодня,"['завтра', 'это', 'всмысле', 'сегодня']","['завтра', 'это', 'в', 'смысле', 'сегодня']",-57.31339211737081,-43.00260874330558
970,однако вернемся к тем ребятам в вашингтоне которые способны в отличие от кремлевских господ мыслить не только сиюминутными интересами но и в стратегическом масштабе,однако вернемся к тем ребятам в вашингтоне которые способны в отличие от кремлевских господ мыслить не только сиюминутными интересами но и в стратегическом масштабе,"['однако', 'вернемся', 'к', 'тем', 'ребятам', 'в', 'вашингтоне', 'которые', 'способны', 'в', 'отличие', 'от', 'кремлевских', 'господ', 'мыслить', 'не', 'только', 'сиюминутными', 'интересами', 'но', 'и', 'в', 'стратегическом', 'масштабе']","['однако', 'вернемся', 'к', 'тем', 'ребятам', 'в', 'вашингтоне', 'которые', 'способны', 'в', 'отличие', 'от', 'кремлевских', 'господ', 'мыслить', 'не', 'только', 'сиюминутными', 'интересами', 'но', 'и', 'в', 'стратегическом', 'масштабе']",-168.38292032253926,-168.24326214383154
971,я занимаюсь продюсированием музыкальных проектов и мне конечно же интересен тот опыт который есть у преподавателей rma говорит певец,я занимаюсь продюсированием музыкальных проектов и мне конечно же интересен тот опыт который есть у преподавателей rma говорит певец,"['я', 'занимаюсь', 'продюсированием', 'музыкальных', 'проектов', 'и', 'мне', 'конечно', 'же', 'интересен', 'тот', 'опыт', 'который', 'есть', 'у', 'преподавателей', 'rma', 'говорит', 'певец']","['я', 'занимаюсь', 'продюсированием', 'музыкальных', 'проектов', 'и', 'мне', 'конечно', 'же', 'интересен', 'тот', 'опыт', 'который', 'есть', 'у', 'преподавателей', 'rma', 'говорит', 'певец']",-145.841672988559,-145.78724944433256
972,фестиваль sonar не обходится и без традиционных концертов,фестиваль sonar не обходится и без традиционных концертов,"['фестиваль', 'sonar', 'не', 'обходится', 'и', 'без', 'традиционных', 'концертов']","['фестиваль', 'sonar', 'не', 'обходится', 'и', 'без', 'традиционных', 'концертов']",-78.30097864469883,-78.3021897426994
973,источник подтвердил что сирийская арабская армия йпри поддержке хизбаллы и некоторых палестинских групп установила контроль над военным аэропортом дабаа и городом эль-ксейр,источник подтвердил что сирийская арабская армия йпри поддержке хизбаллы и некоторых палестинских групп установила контроль над военным аэропортом дабаа и городом эль-ксейр,"['источник', 'подтвердил', 'что', 'сирийская', 'арабская', 'армия', 'йпри', 'поддержке', 'хизбаллы', 'и', 'некоторых', 'палестинских', 'групп', 'установила', 'контроль', 'над', 'военным', 'аэропортом', 'дабаа', 'и', 'городом', 'эль-ксейр']","['источник', 'подтвердил', 'что', 'сирийская', 'арабская', 'армия', 'йпри', 'поддержке', 'хизбаллы', 'и', 'некоторых', 'палестинских', 'групп', 'установила', 'контроль', 'над', 'военным', 'аэропортом', 'дабаа', 'и', 'городом', 'эль-ксейр']",-176.56608315958755,-176.55577831959727
974,поезд был с шестиместными купе мы сначала перепутали места думали что подем вдвоем но когда все выяснилось оказалось что в купе нас все же шестеро,поезд был с шестиместными купе мы сначала перепутали места думали что поедем вдвоем но когда все выяснилось оказалось что в купе нас все же шестеро,"['поезд', 'был', 'с', 'шестиместными', 'купе', 'мы', 'сначала', 'перепутали', 'места', 'думали', 'что', 'подем', 'вдвоем', 'но', 'когда', 'все', 'выяснилось', 'оказалось', 'что', 'в', 'купе', 'нас', 'все', 'же', 'шестеро']","['поезд', 'был', 'с', 'шестиместными', 'купе', 'мы', 'сначала', 'перепутали', 'места', 'думали', 'что', 'поедем', 'вдвоем', 'но', 'когда', 'все', 'выяснилось', 'оказалось', 'что', 'в', 'купе', 'нас', 'все', 'же', 'шестеро']",-201.0429599053328,-176.6015292343271
975,мы слишком ничтожны по сравнению с этим миром чтобы спорить между собой,мы слишком ничтожны по сравнению с этим миром чтобы спорить между собой,"['мы', 'слишком', 'ничтожны', 'по', 'сравнению', 'с', 'этим', 'миром', 'чтобы', 'спорить', 'между', 'собой']","['мы', 'слишком', 'ничтожны', 'по', 'сравнению', 'с', 'этим', 'миром', 'чтобы', 'спорить', 'между', 'собой']",-53.044039513649935,-53.05529967735967
976,надо быть очень сильной чтоб изменить течение событий в жизни,надо быть очень сильной чтоб изменить течение событий в жизни,"['надо', 'быть', 'очень', 'сильной', 'чтоб', 'изменить', 'течение', 'событий', 'в', 'жизни']","['надо', 'быть', 'очень', 'сильной', 'чтоб', 'изменить', 'течение', 'событий', 'в', 'жизни']",-63.07287647294518,-62.67551106937306
977,у пегги ценный был жираф он зализать умел под шкаф,у пегги ценный был жираф он залезать умел под шкаф,"['у', 'пегги', 'ценный', 'был', 'жираф', 'он', 'зализать', 'умел', 'под', 'шкаф']","['у', 'пегги', 'ценный', 'был', 'жираф', 'он', 'залезать', 'умел', 'под', 'шкаф']",-145.53019427879104,-138.58492942231226
978,ужасное землетрясение и цунами в японии разом напомнили нам о том как хрупок человек перед бушующей стихией,ужасное землетрясение и цунами в японии разом напомнили нам о том как хрупок человек перед бушующей стихией,"['ужасное', 'землетрясение', 'и', 'цунами', 'в', 'японии', 'разом', 'напомнили', 'нам', 'о', 'том', 'как', 'хрупок', 'человек', 'перед', 'бушующей', 'стихией']","['ужасное', 'землетрясение', 'и', 'цунами', 'в', 'японии', 'разом', 'напомнили', 'нам', 'о', 'том', 'как', 'хрупок', 'человек', 'перед', 'бушующей', 'стихией']",-108.75113193079245,-108.69942741575193
979,домашний комп достаточно стар мягко говоря поэтому начинает тормозить когда много задач обрабатывается,домашний комп достаточно стар мягко говоря поэтому начинает тормозить когда много задач обрабатывается,"['домашний', 'комп', 'достаточно', 'стар', 'мягко', 'говоря', 'поэтому', 'начинает', 'тормозить', 'когда', 'много', 'задач', 'обрабатывается']","['домашний', 'комп', 'достаточно', 'стар', 'мягко', 'говоря', 'поэтому', 'начинает', 'тормозить', 'когда', 'много', 'задач', 'обрабатывается']",-119.670977759999,-119.71891702582911
980,седняшний сон оказался в чужом теле участвовал в расследовании серийных убийств людей какойто тварью,сегодняшний сон оказался в чужом теле участвовал в расследовании серийных убийств людей какой-то тварью,"['седняшний', 'сон', 'оказался', 'в', 'чужом', 'теле', 'участвовал', 'в', 'расследовании', 'серийных', 'убийств', 'людей', 'какойто', 'тварью']","['сегодняшний', 'сон', 'оказался', 'в', 'чужом', 'теле', 'участвовал', 'в', 'расследовании', 'серийных', 'убийств', 'людей', 'какой-то', 'тварью']",-118.52669213062197,-111.68692264396422
981,легко ли выжить зимой если зима никогда не кончается,легко ли выжить зимой если зима никогда не кончается,"['легко', 'ли', 'выжить', 'зимой', 'если', 'зима', 'никогда', 'не', 'кончается']","['легко', 'ли', 'выжить', 'зимой', 'если', 'зима', 'никогда', 'не', 'кончается']",-57.974456428670365,-58.00872898045157
982,талант находить еду причем вкусную и недорогую у меня почти как у максофраевского сэра кофы да и нетерпелось уже попасть под душ,талант находить еду причем вкусную и недорогую у меня почти как у максофраевского сэра кофы да и не терпелось уже попасть под душ,"['талант', 'находить', 'еду', 'причем', 'вкусную', 'и', 'недорогую', 'у', 'меня', 'почти', 'как', 'у', 'максофраевского', 'сэра', 'кофы', 'да', 'и', 'нетерпелось', 'уже', 'попасть', 'под', 'душ']","['талант', 'находить', 'еду', 'причем', 'вкусную', 'и', 'недорогую', 'у', 'меня', 'почти', 'как', 'у', 'максофраевского', 'сэра', 'кофы', 'да', 'и', 'не', 'терпелось', 'уже', 'попасть', 'под', 'душ']",-186.59727604730665,-185.81850563101324
983,глинтвейн пьется гарячим небольшими глотками как гарячий чай,глинтвейн пьется горячим небольшими глотками как горячий чай,"['глинтвейн', 'пьется', 'гарячим', 'небольшими', 'глотками', 'как', 'гарячий', 'чай']","['глинтвейн', 'пьется', 'горячим', 'небольшими', 'глотками', 'как', 'горячий', 'чай']",-93.4954405870097,-75.34543224357392
984,в общем летать в такой атмосфере реактивному самолету строго противопоказано,в общем летать в такой атмосфере реактивному самолету строго противопоказано,"['в', 'общем', 'летать', 'в', 'такой', 'атмосфере', 'реактивному', 'самолету', 'строго', 'противопоказано']","['в', 'общем', 'летать', 'в', 'такой', 'атмосфере', 'реактивному', 'самолету', 'строго', 'противопоказано']",-98.65596358338752,-98.69711171278327
985,путеводитель рекомендовал ехать ночвать в деревню которая находится возле вулкана но был уже поздний вечер и мы утомленные переездом из акапулько решили остаться в уруапане хотя он не заслуживает ни минуты прибывания и тем более такого длинного поста,путеводитель рекомендовал ехать ночевать в деревню которая находится возле вулкана но был уже поздний вечер и мы утомленные переездом из акапулько решили остаться в уруапане хотя он не заслуживает ни минуты пребывания и тем более такого длинного поста,"['путеводитель', 'рекомендовал', 'ехать', 'ночвать', 'в', 'деревню', 'которая', 'находится', 'возле', 'вулкана', 'но', 'был', 'уже', 'поздний', 'вечер', 'и', 'мы', 'утомленные', 'переездом', 'из', 'акапулько', 'решили', 'остаться', 'в', 'уруапане', 'хотя', 'он', 'не', 'заслуживает', 'ни', 'минуты', 'прибывания', 'и', 'тем', 'более', 'такого', 'длинного', 'поста']","['путеводитель', 'рекомендовал', 'ехать', 'ночевать', 'в', 'деревню', 'которая', 'находится', 'возле', 'вулкана', 'но', 'был', 'уже', 'поздний', 'вечер', 'и', 'мы', 'утомленные', 'переездом', 'из', 'акапулько', 'решили', 'остаться', 'в', 'уруапане', 'хотя', 'он', 'не', 'заслуживает', 'ни', 'минуты', 'пребывания', 'и', 'тем', 'более', 'такого', 'длинного', 'поста']",-301.1453043502846,-294.785058125928
986,когда решение принято правильно тогда и получаешь соответствующий результат,когда решение принято правильно тогда и получаешь соответствующий результат,"['когда', 'решение', 'принято', 'правильно', 'тогда', 'и', 'получаешь', 'соответствующий', 'результат']","['когда', 'решение', 'принято', 'правильно', 'тогда', 'и', 'получаешь', 'соответствующий', 'результат']",-88.01615096002789,-88.0228376104838
987,беспокойство в связи с происходящим в египте выразили также высшие представители иракских шиитов,беспокойство в связи с происходящим в египте выразили также высшие представители иракских шиитов,"['беспокойство', 'в', 'связи', 'с', 'происходящим', 'в', 'египте', 'выразили', 'также', 'высшие', 'представители', 'иракских', 'шиитов']","['беспокойство', 'в', 'связи', 'с', 'происходящим', 'в', 'египте', 'выразили', 'также', 'высшие', 'представители', 'иракских', 'шиитов']",-106.05312858419067,-106.05373170427039
988,родригез победил по количеству образов один в один а савичева по количеству мурашек,родригез победил по количеству образов один в один а савичева по количеству мурашек,"['родригез', 'победил', 'по', 'количеству', 'образов', 'один', 'в', 'один', 'а', 'савичева', 'по', 'количеству', 'мурашек']","['родригез', 'победил', 'по', 'количеству', 'образов', 'один', 'в', 'один', 'а', 'савичева', 'по', 'количеству', 'мурашек']",-123.7286466355958,-123.75264509690506
989,да с этим не поспоришь согласна всеравно по своему все,да с этим не поспоришь согласна все равно по-своему все,"['да', 'с', 'этим', 'не', 'поспоришь', 'согласна', 'всеравно', 'по', 'своему', 'все']","['да', 'с', 'этим', 'не', 'поспоришь', 'согласна', 'все', 'равно', 'по-своему', 'все']",-68.5492192789514,-63.93227718556044
