,source,true,tokenized_source,tokenized_true,source_likelihood,true_likelihood
482,жаль что на плюсовой тарелке потенциал был побольше,жаль что на плюсовой тарелке потенциал был побольше,"['жаль', 'что', 'на', 'плюсовой', 'тарелке', 'потенциал', 'был', 'побольше']","['жаль', 'что', 'на', 'плюсовой', 'тарелке', 'потенциал', 'был', 'побольше']",-89.7758068430486,-89.77262135864346
483,и хотя объективно понимаю что они вряд ли станут чемпионами мира в этот раз верю что немцев пройти они в состоянии,и хотя объективно понимаю что они вряд ли станут чемпионами мира в этот раз верю что немцев пройти они в состоянии,"['и', 'хотя', 'объективно', 'понимаю', 'что', 'они', 'вряд', 'ли', 'станут', 'чемпионами', 'мира', 'в', 'этот', 'раз', 'верю', 'что', 'немцев', 'пройти', 'они', 'в', 'состоянии']","['и', 'хотя', 'объективно', 'понимаю', 'что', 'они', 'вряд', 'ли', 'станут', 'чемпионами', 'мира', 'в', 'этот', 'раз', 'верю', 'что', 'немцев', 'пройти', 'они', 'в', 'состоянии']",-118.9785022844319,-118.96945414922044
484,ай какой хороший сказал дмитрий иванович разглядывая пса,ай какой хороший сказал дмитрий иванович разглядывая пса,"['ай', 'какой', 'хороший', 'сказал', 'дмитрий', 'иванович', 'разглядывая', 'пса']","['ай', 'какой', 'хороший', 'сказал', 'дмитрий', 'иванович', 'разглядывая', 'пса']",-86.42019013507476,-86.31242421553245
485,что характерно на карте не видно в этих местах никаких серьезных топографических особенностей ввиде мысов и заливов интересненько,что характерно на карте не видно в этих местах никаких серьезных топографических особенностей в виде мысов и заливов интересненько,"['что', 'характерно', 'на', 'карте', 'не', 'видно', 'в', 'этих', 'местах', 'никаких', 'серьезных', 'топографических', 'особенностей', 'ввиде', 'мысов', 'и', 'заливов', 'интересненько']","['что', 'характерно', 'на', 'карте', 'не', 'видно', 'в', 'этих', 'местах', 'никаких', 'серьезных', 'топографических', 'особенностей', 'в', 'виде', 'мысов', 'и', 'заливов', 'интересненько']",-153.3845172143388,-144.04644356558234
486,не скрою в нашей редакции такие макеты тоже есть когда рекламы нет и называются они затычками пардон за ассоциации но у нас в них нет педалирования ложно-русской темы а даже таки и наоборот телефон редакции инфа про наш сайт,не скрою в нашей редакции такие макеты тоже есть когда рекламы нет и называются они затычками пардон за ассоциации но у нас в них нет педалирования ложно-русской темы а даже таки и наоборот телефон редакции инфа про наш сайт,"['не', 'скрою', 'в', 'нашей', 'редакции', 'такие', 'макеты', 'тоже', 'есть', 'когда', 'рекламы', 'нет', 'и', 'называются', 'они', 'затычками', 'пардон', 'за', 'ассоциации', 'но', 'у', 'нас', 'в', 'них', 'нет', 'педалирования', 'ложно-русской', 'темы', 'а', 'даже', 'таки', 'и', 'наоборот', 'телефон', 'редакции', 'инфа', 'про', 'наш', 'сайт']","['не', 'скрою', 'в', 'нашей', 'редакции', 'такие', 'макеты', 'тоже', 'есть', 'когда', 'рекламы', 'нет', 'и', 'называются', 'они', 'затычками', 'пардон', 'за', 'ассоциации', 'но', 'у', 'нас', 'в', 'них', 'нет', 'педалирования', 'ложно-русской', 'темы', 'а', 'даже', 'таки', 'и', 'наоборот', 'телефон', 'редакции', 'инфа', 'про', 'наш', 'сайт']",-295.40311419761673,-295.41035925544696
487,в кои-то веки зашла в этот журнал почиститься от спама поэтому чтобы два раза не вставать вот вам картинка относительно свежая,в кои-то веки зашла в этот журнал почиститься от спама поэтому чтобы два раза не вставать вот вам картинка относительно свежая,"['в', 'кои-то', 'веки', 'зашла', 'в', 'этот', 'журнал', 'почиститься', 'от', 'спама', 'поэтому', 'чтобы', 'два', 'раза', 'не', 'вставать', 'вот', 'вам', 'картинка', 'относительно', 'свежая']","['в', 'кои-то', 'веки', 'зашла', 'в', 'этот', 'журнал', 'почиститься', 'от', 'спама', 'поэтому', 'чтобы', 'два', 'раза', 'не', 'вставать', 'вот', 'вам', 'картинка', 'относительно', 'свежая']",-141.40322764960828,-141.38327592596454
488,меня рекомендовал один зам директора и мой будущий непосредственный начальник благосклонен,меня рекомендовал один зам директора и мой будущий непосредственный начальник благосклонен,"['меня', 'рекомендовал', 'один', 'зам', 'директора', 'и', 'мой', 'будущий', 'непосредственный', 'начальник', 'благосклонен']","['меня', 'рекомендовал', 'один', 'зам', 'директора', 'и', 'мой', 'будущий', 'непосредственный', 'начальник', 'благосклонен']",-110.31645790822071,-110.36192745692587
489,герой умершей страны готика выражающая перманентное настроение саппортов и иже с ними,герой умершей страны готика выражающая перманентное настроение саппортов и иже с ними,"['герой', 'умершей', 'страны', 'готика', 'выражающая', 'перманентное', 'настроение', 'саппортов', 'и', 'иже', 'с', 'ними']","['герой', 'умершей', 'страны', 'готика', 'выражающая', 'перманентное', 'настроение', 'саппортов', 'и', 'иже', 'с', 'ними']",-137.7393983848162,-137.67881625194346
490,стараюсь больше общаться с людми,стараюсь больше общаться с людьми,"['стараюсь', 'больше', 'общаться', 'с', 'людми']","['стараюсь', 'больше', 'общаться', 'с', 'людьми']",-42.21193667409884,-31.394627284347397
491,я и слов то таких не знаю и вопще вот чему взрослые детей учат выражаються тут понимаешь,я и слов-то таких не знаю и вообще вот чему взрослые детей учат выражаются тут понимаешь,"['я', 'и', 'слов', 'то', 'таких', 'не', 'знаю', 'и', 'вопще', 'вот', 'чему', 'взрослые', 'детей', 'учат', 'выражаються', 'тут', 'понимаешь']","['я', 'и', 'слов-то', 'таких', 'не', 'знаю', 'и', 'вообще', 'вот', 'чему', 'взрослые', 'детей', 'учат', 'выражаются', 'тут', 'понимаешь']",-156.08302819939638,-131.635726715333
492,я неверю в судьбу представишь себе как ктото дергает за ниточки и управляет тобой как ты пляшешь под чьюто дудку,я не верю в судьбу представишь себе как кто-то дергает за ниточки и управляет тобой как ты пляшешь под чью-то дудку,"['я', 'неверю', 'в', 'судьбу', 'представишь', 'себе', 'как', 'ктото', 'дергает', 'за', 'ниточки', 'и', 'управляет', 'тобой', 'как', 'ты', 'пляшешь', 'под', 'чьюто', 'дудку']","['я', 'не', 'верю', 'в', 'судьбу', 'представишь', 'себе', 'как', 'кто-то', 'дергает', 'за', 'ниточки', 'и', 'управляет', 'тобой', 'как', 'ты', 'пляшешь', 'под', 'чью-то', 'дудку']",-179.87244598841968,-124.5627176016194
493,ты сам себе создаешь проблемы пойми что мир не будет приклонятся перед тобой и притиратся к твоим взглядам,ты сам себе создаешь проблемы пойми что мир не будет преклоняться перед тобой и притираться к твоим взглядам,"['ты', 'сам', 'себе', 'создаешь', 'проблемы', 'пойми', 'что', 'мир', 'не', 'будет', 'приклонятся', 'перед', 'тобой', 'и', 'притиратся', 'к', 'твоим', 'взглядам']","['ты', 'сам', 'себе', 'создаешь', 'проблемы', 'пойми', 'что', 'мир', 'не', 'будет', 'преклоняться', 'перед', 'тобой', 'и', 'притираться', 'к', 'твоим', 'взглядам']",-111.64706797241013,-98.88425774204833
494,здарова мы живем в реальном мире и поэтому зачастую нам приходится иметь дело,здорово мы живем в реальном мире и поэтому зачастую нам приходится иметь дело,"['здарова', 'мы', 'живем', 'в', 'реальном', 'мире', 'и', 'поэтому', 'зачастую', 'нам', 'приходится', 'иметь', 'дело']","['здорово', 'мы', 'живем', 'в', 'реальном', 'мире', 'и', 'поэтому', 'зачастую', 'нам', 'приходится', 'иметь', 'дело']",-86.38311592160983,-73.44636925912494
495,ну вот только меряться достижениями не надо,ну вот только мериться достижениями не надо,"['ну', 'вот', 'только', 'меряться', 'достижениями', 'не', 'надо']","['ну', 'вот', 'только', 'мериться', 'достижениями', 'не', 'надо']",-54.87653836338055,-54.6396945473746
496,понимаешь грит они на меня надеятся,понимаешь говорит они на меня надеятся,"['понимаешь', 'грит', 'они', 'на', 'меня', 'надеятся']","['понимаешь', 'говорит', 'они', 'на', 'меня', 'надеятся']",-65.85043915389593,-64.5408508330375
497,возвращаясь к вопросу транспорта есть и машины огого какие авто и автобусы и прочее но все-таки вышекуказанные тарахтелки занимают первое место,возвращаясь к вопросу транспорта есть и машины ого-го какие авто и автобусы и прочее но все-таки вышеуказанные тарахтелки занимают первое место,"['возвращаясь', 'к', 'вопросу', 'транспорта', 'есть', 'и', 'машины', 'огого', 'какие', 'авто', 'и', 'автобусы', 'и', 'прочее', 'но', 'все-таки', 'вышекуказанные', 'тарахтелки', 'занимают', 'первое', 'место']","['возвращаясь', 'к', 'вопросу', 'транспорта', 'есть', 'и', 'машины', 'ого-го', 'какие', 'авто', 'и', 'автобусы', 'и', 'прочее', 'но', 'все-таки', 'вышеуказанные', 'тарахтелки', 'занимают', 'первое', 'место']",-166.03385553857007,-166.5950390679798
498,"ну за 1,5 недели я врядли замуж выйду вероятность петерь есть но такая же как и обычно так что","ну за 1,5 недели я вряд ли замуж выйду вероятность теперь есть но такая же как и обычно так что","['ну', 'за', '1,5', 'недели', 'я', 'врядли', 'замуж', 'выйду', 'вероятность', 'петерь', 'есть', 'но', 'такая', 'же', 'как', 'и', 'обычно', 'так', 'что']","['ну', 'за', '1,5', 'недели', 'я', 'вряд', 'ли', 'замуж', 'выйду', 'вероятность', 'теперь', 'есть', 'но', 'такая', 'же', 'как', 'и', 'обычно', 'так', 'что']",-132.58384780767878,-114.22806036857463
499,отдельно жж отдельно другие блог-системы отдельно форумы отделно сетевые сми слабы механизмы вовлечения реала,отдельно жж отдельно другие блог-системы отдельно форумы отдельно сетевые сми слабы механизмы вовлечения реала,"['отдельно', 'жж', 'отдельно', 'другие', 'блог-системы', 'отдельно', 'форумы', 'отделно', 'сетевые', 'сми', 'слабы', 'механизмы', 'вовлечения', 'реала']","['отдельно', 'жж', 'отдельно', 'другие', 'блог-системы', 'отдельно', 'форумы', 'отдельно', 'сетевые', 'сми', 'слабы', 'механизмы', 'вовлечения', 'реала']",-213.04449450352166,-212.68820003781985
500,как не хочеться верить в эту фразу,как не хочется верить в эту фразу,"['как', 'не', 'хочеться', 'верить', 'в', 'эту', 'фразу']","['как', 'не', 'хочется', 'верить', 'в', 'эту', 'фразу']",-33.02835055956884,-26.481831351330975
501,столетний мишка точь в точь из мультика старая игрушка,столетний мишка точь-в-точь из мультика старая игрушка,"['столетний', 'мишка', 'точь', 'в', 'точь', 'из', 'мультика', 'старая', 'игрушка']","['столетний', 'мишка', 'точь-в-точь', 'из', 'мультика', 'старая', 'игрушка']",-68.96272542656226,-83.6477123041503
502,софта не сказать что мало но нехватает точно,софта не сказать что мало но не хватает точно,"['софта', 'не', 'сказать', 'что', 'мало', 'но', 'нехватает', 'точно']","['софта', 'не', 'сказать', 'что', 'мало', 'но', 'не', 'хватает', 'точно']",-89.74670470753384,-82.34099082217668
503,а может посидеть несколько ночей в поисках формы предать им вид эссе рассказов глав одной повести,а может посидеть несколько ночей в поисках формы придать им вид эссе рассказов глав одной повести,"['а', 'может', 'посидеть', 'несколько', 'ночей', 'в', 'поисках', 'формы', 'предать', 'им', 'вид', 'эссе', 'рассказов', 'глав', 'одной', 'повести']","['а', 'может', 'посидеть', 'несколько', 'ночей', 'в', 'поисках', 'формы', 'придать', 'им', 'вид', 'эссе', 'рассказов', 'глав', 'одной', 'повести']",-162.49573065712622,-149.20240938761924
504,первый матч игрового дня мхл принес три очка крыльям советов во встрече с мхк динамо,первый матч игрового дня мхл принес три очка крыльям советов во встрече с мхк динамо,"['первый', 'матч', 'игрового', 'дня', 'мхл', 'принес', 'три', 'очка', 'крыльям', 'советов', 'во', 'встрече', 'с', 'мхк', 'динамо']","['первый', 'матч', 'игрового', 'дня', 'мхл', 'принес', 'три', 'очка', 'крыльям', 'советов', 'во', 'встрече', 'с', 'мхк', 'динамо']",-148.8198907887672,-148.8191190211725
505,вот счас половником тя махну,вот сейчас половником тебя махну,"['вот', 'счас', 'половником', 'тя', 'махну']","['вот', 'сейчас', 'половником', 'тебя', 'махну']",-77.6932148830615,-74.09579645660081
506,за следущие 50 лет филиппинцев переучили с испанского на английский остались только характерные имена и названия но не отучили любить белого хозяина,за следующие 50 лет филиппинцев переучили с испанского на английский остались только характерные имена и названия но не отучили любить белого хозяина,"['за', 'следущие', '50', 'лет', 'филиппинцев', 'переучили', 'с', 'испанского', 'на', 'английский', 'остались', 'только', 'характерные', 'имена', 'и', 'названия', 'но', 'не', 'отучили', 'любить', 'белого', 'хозяина']","['за', 'следующие', '50', 'лет', 'филиппинцев', 'переучили', 'с', 'испанского', 'на', 'английский', 'остались', 'только', 'характерные', 'имена', 'и', 'названия', 'но', 'не', 'отучили', 'любить', 'белого', 'хозяина']",-188.43942237669094,-185.18243400628737
507,у нас какя-то черная-черная полоса,у нас какая-то черная-черная полоса,"['у', 'нас', 'какя-то', 'черная-черная', 'полоса']","['у', 'нас', 'какая-то', 'черная-черная', 'полоса']",-74.26055188713751,-52.497319618091495
508,да там ляпота и птички поют,да там лепота и птички поют,"['да', 'там', 'ляпота', 'и', 'птички', 'поют']","['да', 'там', 'лепота', 'и', 'птички', 'поют']",-55.73375582334647,-48.10225895755258
509,мимо тебя никто равнодушно не проходит наоборот обращают неподдельное внимание и,мимо тебя никто равнодушно не проходит наоборот обращают неподдельное внимание и,"['мимо', 'тебя', 'никто', 'равнодушно', 'не', 'проходит', 'наоборот', 'обращают', 'неподдельное', 'внимание', 'и']","['мимо', 'тебя', 'никто', 'равнодушно', 'не', 'проходит', 'наоборот', 'обращают', 'неподдельное', 'внимание', 'и']",-101.8716126617406,-101.97337802576169
510,дальше шло всеобщее братание с флагами криками танцами,дальше шло всеобщее братание с флагами криками танцами,"['дальше', 'шло', 'всеобщее', 'братание', 'с', 'флагами', 'криками', 'танцами']","['дальше', 'шло', 'всеобщее', 'братание', 'с', 'флагами', 'криками', 'танцами']",-109.9323110610946,-109.96116263628328
511,здесь же на улице и в небольшом ангаре его пилили и какието умельцы сразу же из него чтото делали,здесь же на улице и в небольшом ангаре его пилили и какие-то умельцы сразу же из него что-то делали,"['здесь', 'же', 'на', 'улице', 'и', 'в', 'небольшом', 'ангаре', 'его', 'пилили', 'и', 'какието', 'умельцы', 'сразу', 'же', 'из', 'него', 'чтото', 'делали']","['здесь', 'же', 'на', 'улице', 'и', 'в', 'небольшом', 'ангаре', 'его', 'пилили', 'и', 'какие-то', 'умельцы', 'сразу', 'же', 'из', 'него', 'что-то', 'делали']",-120.17438340240247,-110.67415071322506
512,обажаю начинать писать текст не зная даже что будет в следующей строчке,обожаю начинать писать текст не зная даже что будет в следующей строчке,"['обажаю', 'начинать', 'писать', 'текст', 'не', 'зная', 'даже', 'что', 'будет', 'в', 'следующей', 'строчке']","['обожаю', 'начинать', 'писать', 'текст', 'не', 'зная', 'даже', 'что', 'будет', 'в', 'следующей', 'строчке']",-83.17079362581326,-66.32959541033429
513,в озерском районе жена бывшего градоначальника приобрела добрый кусок калининградской земли и открыла конезавод с романтичным названием веедерн,в озерском районе жена бывшего градоначальника приобрела добрый кусок калининградской земли и открыла конезавод с романтичным названием веедерн,"['в', 'озерском', 'районе', 'жена', 'бывшего', 'градоначальника', 'приобрела', 'добрый', 'кусок', 'калининградской', 'земли', 'и', 'открыла', 'конезавод', 'с', 'романтичным', 'названием', 'веедерн']","['в', 'озерском', 'районе', 'жена', 'бывшего', 'градоначальника', 'приобрела', 'добрый', 'кусок', 'калининградской', 'земли', 'и', 'открыла', 'конезавод', 'с', 'романтичным', 'названием', 'веедерн']",-152.6389317000444,-152.66861825322303
514,вчера все русские девчонки включая увы и меня были пьяны,вчера все русские девчонки включая увы и меня были пьяны,"['вчера', 'все', 'русские', 'девчонки', 'включая', 'увы', 'и', 'меня', 'были', 'пьяны']","['вчера', 'все', 'русские', 'девчонки', 'включая', 'увы', 'и', 'меня', 'были', 'пьяны']",-103.85619230047557,-103.85416402288413
515,как часто каким способом и для чего мы открываем двери,как часто каким способом и для чего мы открываем двери,"['как', 'часто', 'каким', 'способом', 'и', 'для', 'чего', 'мы', 'открываем', 'двери']","['как', 'часто', 'каким', 'способом', 'и', 'для', 'чего', 'мы', 'открываем', 'двери']",-52.46130438186532,-52.43899188230529
