,source,true,tokenized_source,tokenized_true,source_likelihood,true_likelihood
0,есть у вас оформленый и подписаный мною заказ,есть у вас оформленный и подписанный мною заказ,"['есть', 'у', 'вас', 'оформленый', 'и', 'подписаный', 'мною', 'заказ']","['есть', 'у', 'вас', 'оформленный', 'и', 'подписанный', 'мною', 'заказ']",-85.50559204799954,-76.29896328327128
1,вот в инете откапал такую интеерсную статейку предлагаю вашему внимани,вот в инете откопал такую интересную статейку предлагаю вашему вниманию,"['вот', 'в', 'инете', 'откапал', 'такую', 'интеерсную', 'статейку', 'предлагаю', 'вашему', 'внимани']","['вот', 'в', 'инете', 'откопал', 'такую', 'интересную', 'статейку', 'предлагаю', 'вашему', 'вниманию']",-116.28374326631777,-54.1954461405757
2,я на всю жизнь запомню свое первое купание в зимнем ледяном енисее,я на всю жизнь запомню свое первое купание в зимнем ледяном енисее,"['я', 'на', 'всю', 'жизнь', 'запомню', 'свое', 'первое', 'купание', 'в', 'зимнем', 'ледяном', 'енисее']","['я', 'на', 'всю', 'жизнь', 'запомню', 'свое', 'первое', 'купание', 'в', 'зимнем', 'ледяном', 'енисее']",-77.96688297645062,-77.20561578809584
3,думаем что не ошибемся если скажем что выставка лучшие фотографии россии 2012 станет одним из самых значимых событий в культурной жизни перми и ее жителей,думаем что не ошибемся если скажем что выставка лучшие фотографии россии 2012 станет одним из самых значимых событий в культурной жизни перми и ее жителей,"['думаем', 'что', 'не', 'ошибемся', 'если', 'скажем', 'что', 'выставка', 'лучшие', 'фотографии', 'россии', '2012', 'станет', 'одним', 'из', 'самых', 'значимых', 'событий', 'в', 'культурной', 'жизни', 'перми', 'и', 'ее', 'жителей']","['думаем', 'что', 'не', 'ошибемся', 'если', 'скажем', 'что', 'выставка', 'лучшие', 'фотографии', 'россии', '2012', 'станет', 'одним', 'из', 'самых', 'значимых', 'событий', 'в', 'культурной', 'жизни', 'перми', 'и', 'ее', 'жителей']",-149.8420152924042,-151.55062360983695
4,судьба человека может складываться очень разнообразно в жизни много прекрасных светлых радостных моментов,судьба человека может складываться очень разнообразно в жизни много прекрасных светлых радостных моментов,"['судьба', 'человека', 'может', 'складываться', 'очень', 'разнообразно', 'в', 'жизни', 'много', 'прекрасных', 'светлых', 'радостных', 'моментов']","['судьба', 'человека', 'может', 'складываться', 'очень', 'разнообразно', 'в', 'жизни', 'много', 'прекрасных', 'светлых', 'радостных', 'моментов']",-97.95335349965242,-96.41548053535124
5,а я думаю вот если бы хозяин этой лодки тебе ее подарил и ты бы собрал знакомых и устроил на этой лодке большие катание с размахом,а я думаю вот если бы хозяин этой лодки тебе ее подарил и ты бы собрал знакомых и устроил на этой лодке большие катание с размахом,"['а', 'я', 'думаю', 'вот', 'если', 'бы', 'хозяин', 'этой', 'лодки', 'тебе', 'ее', 'подарил', 'и', 'ты', 'бы', 'собрал', 'знакомых', 'и', 'устроил', 'на', 'этой', 'лодке', 'большие', 'катание', 'с', 'размахом']","['а', 'я', 'думаю', 'вот', 'если', 'бы', 'хозяин', 'этой', 'лодки', 'тебе', 'ее', 'подарил', 'и', 'ты', 'бы', 'собрал', 'знакомых', 'и', 'устроил', 'на', 'этой', 'лодке', 'большие', 'катание', 'с', 'размахом']",-142.62325701338884,-141.61430468847993
6,например парадный портрет николая ii при орденах и регалиях освященный как икона и снабженный 5-рублевой монетой и роскошным текстом снизу,например парадный портрет николая ii при орденах и регалиях освященный как икона и снабженный 5-рублевой монетой и роскошным текстом снизу,"['например', 'парадный', 'портрет', 'николая', 'ii', 'при', 'орденах', 'и', 'регалиях', 'освященный', 'как', 'икона', 'и', 'снабженный', '5-рублевой', 'монетой', 'и', 'роскошным', 'текстом', 'снизу']","['например', 'парадный', 'портрет', 'николая', 'ii', 'при', 'орденах', 'и', 'регалиях', 'освященный', 'как', 'икона', 'и', 'снабженный', '5-рублевой', 'монетой', 'и', 'роскошным', 'текстом', 'снизу']",-225.4172098079176,-227.01189201120502
7,двубортное кашемировое пальто песочного цвета классическог фасона,двубортное кашемировое пальто песочного цвета классического фасона,"['двубортное', 'кашемировое', 'пальто', 'песочного', 'цвета', 'классическог', 'фасона']","['двубортное', 'кашемировое', 'пальто', 'песочного', 'цвета', 'классического', 'фасона']",-96.99978420706285,-82.89783439237812
8,поговорила с директором и он мне обежал позвонить вечером и сказать берет он меня на работу,поговорила с директором и он мне обещал позвонить вечером и сказать берет он меня на работу,"['поговорила', 'с', 'директором', 'и', 'он', 'мне', 'обежал', 'позвонить', 'вечером', 'и', 'сказать', 'берет', 'он', 'меня', 'на', 'работу']","['поговорила', 'с', 'директором', 'и', 'он', 'мне', 'обещал', 'позвонить', 'вечером', 'и', 'сказать', 'берет', 'он', 'меня', 'на', 'работу']",-101.90218304959629,-77.19647160479082
9,схездил птом в ркб оказалось что на нем 3 царапины купил мази и капли,съездил потом в ркб оказалось что на нем 3 царапины купил мази и капли,"['схездил', 'птом', 'в', 'ркб', 'оказалось', 'что', 'на', 'нем', '3', 'царапины', 'купил', 'мази', 'и', 'капли']","['съездил', 'потом', 'в', 'ркб', 'оказалось', 'что', 'на', 'нем', '3', 'царапины', 'купил', 'мази', 'и', 'капли']",-146.7552522714986,-138.29849861174395
10,но даже когда мы приблизились к нижнему уровню замка я поверить не могла что он такой огромный как показывалось на карте,но даже когда мы приблизились к нижнему уровню замка я поверить не могла что он такой огромный как показывалось на карте,"['но', 'даже', 'когда', 'мы', 'приблизились', 'к', 'нижнему', 'уровню', 'замка', 'я', 'поверить', 'не', 'могла', 'что', 'он', 'такой', 'огромный', 'как', 'показывалось', 'на', 'карте']","['но', 'даже', 'когда', 'мы', 'приблизились', 'к', 'нижнему', 'уровню', 'замка', 'я', 'поверить', 'не', 'могла', 'что', 'он', 'такой', 'огромный', 'как', 'показывалось', 'на', 'карте']",-121.13070154567215,-122.25410184940255
11,давно стоит понять что в этой жизни никто не зделает так как лутче тебе,давно стоит понять что в этой жизни никто не сделает так как лучше тебе,"['давно', 'стоит', 'понять', 'что', 'в', 'этой', 'жизни', 'никто', 'не', 'зделает', 'так', 'как', 'лутче', 'тебе']","['давно', 'стоит', 'понять', 'что', 'в', 'этой', 'жизни', 'никто', 'не', 'сделает', 'так', 'как', 'лучше', 'тебе']",-90.46304027984128,-67.43068736049091
12,а вообще конечно не представляю как все писят лет все забавляются над дядькой,а вообще конечно не представляю как все пятьдесят лет все забавляются над дядькой,"['а', 'вообще', 'конечно', 'не', 'представляю', 'как', 'все', 'писят', 'лет', 'все', 'забавляются', 'над', 'дядькой']","['а', 'вообще', 'конечно', 'не', 'представляю', 'как', 'все', 'пятьдесят', 'лет', 'все', 'забавляются', 'над', 'дядькой']",-112.09160170252407,-96.66882253348604
13,отработав под палящим магдалиновским солнцем народ ринулся к воде к самой чистой в,отработав под палящим магдалиновским солнцем народ ринулся к воде к самой чистой в,"['отработав', 'под', 'палящим', 'магдалиновским', 'солнцем', 'народ', 'ринулся', 'к', 'воде', 'к', 'самой', 'чистой', 'в']","['отработав', 'под', 'палящим', 'магдалиновским', 'солнцем', 'народ', 'ринулся', 'к', 'воде', 'к', 'самой', 'чистой', 'в']",-120.5734027303963,-118.9256970872035
14,акцент в последнем предложении правда не совсем понятен,акцент в последнем предложении правда не совсем понятен,"['акцент', 'в', 'последнем', 'предложении', 'правда', 'не', 'совсем', 'понятен']","['акцент', 'в', 'последнем', 'предложении', 'правда', 'не', 'совсем', 'понятен']",-66.02676660398264,-63.78056949519832
15,в детстве я был толстым кучерявым и чрезвычайно прожорливым блондином,в детстве я был толстым кучерявым и чрезвычайно прожорливым блондином,"['в', 'детстве', 'я', 'был', 'толстым', 'кучерявым', 'и', 'чрезвычайно', 'прожорливым', 'блондином']","['в', 'детстве', 'я', 'был', 'толстым', 'кучерявым', 'и', 'чрезвычайно', 'прожорливым', 'блондином']",-86.5744057343131,-86.09092445531788
16,он сейчас в отъезде но почту проверять должен переодически,он сейчас в отъезде но почту проверять должен периодически,"['он', 'сейчас', 'в', 'отъезде', 'но', 'почту', 'проверять', 'должен', 'переодически']","['он', 'сейчас', 'в', 'отъезде', 'но', 'почту', 'проверять', 'должен', 'периодически']",-92.8969394047448,-92.92121666279081
17,колодцы практически везде оборудованы вот такими колесами наверное традиция,колодцы практически везде оборудованы вот такими колесами наверное традиция,"['колодцы', 'практически', 'везде', 'оборудованы', 'вот', 'такими', 'колесами', 'наверное', 'традиция']","['колодцы', 'практически', 'везде', 'оборудованы', 'вот', 'такими', 'колесами', 'наверное', 'традиция']",-104.77764005065497,-105.31834634901176
18,через пару минут он возращаеться и приносит два стакана честно говоря я так и не понял почему два ну да ладно нам не привыкать и когда я ему объяснил что нужно было три он долго порывался сбегать еще раз но видя какие стаканы он принес я понял что лучше пить из горла а стаканы или даже точнее бокалы енти это отдельная история енто были огромные бокалы под коктель маргарита,через пару минут он возвращается и приносит два стакана честно говоря я так и не понял почему два ну да ладно нам не привыкать и когда я ему объяснил что нужно было три он долго порывался сбегать еще раз но видя какие стаканы он принес я понял что лучше пить из горла а стаканы или даже точнее бокалы эти это отдельная история это были огромные бокалы под коктейль маргарита,"['через', 'пару', 'минут', 'он', 'возращаеться', 'и', 'приносит', 'два', 'стакана', 'честно', 'говоря', 'я', 'так', 'и', 'не', 'понял', 'почему', 'два', 'ну', 'да', 'ладно', 'нам', 'не', 'привыкать', 'и', 'когда', 'я', 'ему', 'объяснил', 'что', 'нужно', 'было', 'три', 'он', 'долго', 'порывался', 'сбегать', 'еще', 'раз', 'но', 'видя', 'какие', 'стаканы', 'он', 'принес', 'я', 'понял', 'что', 'лучше', 'пить', 'из', 'горла', 'а', 'стаканы', 'или', 'даже', 'точнее', 'бокалы', 'енти', 'это', 'отдельная', 'история', 'енто', 'были', 'огромные', 'бокалы', 'под', 'коктель', 'маргарита']","['через', 'пару', 'минут', 'он', 'возвращается', 'и', 'приносит', 'два', 'стакана', 'честно', 'говоря', 'я', 'так', 'и', 'не', 'понял', 'почему', 'два', 'ну', 'да', 'ладно', 'нам', 'не', 'привыкать', 'и', 'когда', 'я', 'ему', 'объяснил', 'что', 'нужно', 'было', 'три', 'он', 'долго', 'порывался', 'сбегать', 'еще', 'раз', 'но', 'видя', 'какие', 'стаканы', 'он', 'принес', 'я', 'понял', 'что', 'лучше', 'пить', 'из', 'горла', 'а', 'стаканы', 'или', 'даже', 'точнее', 'бокалы', 'эти', 'это', 'отдельная', 'история', 'это', 'были', 'огромные', 'бокалы', 'под', 'коктейль', 'маргарита']",-429.44805309545774,-389.6135360859882
19,живет где надо тормозит где надо разгоняется ставит цели и достегает их или просто сидит дома смотрит аниме,живет где надо тормозит где надо разгоняется ставит цели и достигает их или просто сидит дома смотрит аниме,"['живет', 'где', 'надо', 'тормозит', 'где', 'надо', 'разгоняется', 'ставит', 'цели', 'и', 'достегает', 'их', 'или', 'просто', 'сидит', 'дома', 'смотрит', 'аниме']","['живет', 'где', 'надо', 'тормозит', 'где', 'надо', 'разгоняется', 'ставит', 'цели', 'и', 'достигает', 'их', 'или', 'просто', 'сидит', 'дома', 'смотрит', 'аниме']",-168.1577102827943,-166.70556660041896
20,на второй день своего прибывания в общаге я заметил теннисный стол в общей комнате в доме напротив,на второй день своего пребывания в общаге я заметил теннисный стол в общей комнате в доме напротив,"['на', 'второй', 'день', 'своего', 'прибывания', 'в', 'общаге', 'я', 'заметил', 'теннисный', 'стол', 'в', 'общей', 'комнате', 'в', 'доме', 'напротив']","['на', 'второй', 'день', 'своего', 'пребывания', 'в', 'общаге', 'я', 'заметил', 'теннисный', 'стол', 'в', 'общей', 'комнате', 'в', 'доме', 'напротив']",-76.37979871064849,-75.99673848040707
21,последние пять тысяч лет человеческая нога туда не ступала даже у восьмого департамента что-то не сложилось,последние пять тысяч лет человеческая нога туда не ступала даже у восьмого департамента что-то не сложилось,"['последние', 'пять', 'тысяч', 'лет', 'человеческая', 'нога', 'туда', 'не', 'ступала', 'даже', 'у', 'восьмого', 'департамента', 'что-то', 'не', 'сложилось']","['последние', 'пять', 'тысяч', 'лет', 'человеческая', 'нога', 'туда', 'не', 'ступала', 'даже', 'у', 'восьмого', 'департамента', 'что-то', 'не', 'сложилось']",-126.36661252539129,-126.2465283341281
22,шеф просил учавствовать в тендере ceo,шеф просил участвовать в тендере ceo,"['шеф', 'просил', 'учавствовать', 'в', 'тендере', 'ceo']","['шеф', 'просил', 'участвовать', 'в', 'тендере', 'ceo']",-90.24785891176373,-88.38566133521195
23,а теперь смотрите чтоже мы увидили,а теперь смотрите что же мы увидели,"['а', 'теперь', 'смотрите', 'чтоже', 'мы', 'увидили']","['а', 'теперь', 'смотрите', 'что', 'же', 'мы', 'увидели']",-60.34449623253876,-46.02596393026131
24,я не тьолка я девачка,я не телка я девочка,"['я', 'не', 'тьолка', 'я', 'девачка']","['я', 'не', 'телка', 'я', 'девочка']",-56.66663085658851,-37.39685923600385
25,в общем началась война и через два года оба племени истребили друг друга полностью,в общем началась война и через два года оба племени истребили друг друга полностью,"['в', 'общем', 'началась', 'война', 'и', 'через', 'два', 'года', 'оба', 'племени', 'истребили', 'друг', 'друга', 'полностью']","['в', 'общем', 'началась', 'война', 'и', 'через', 'два', 'года', 'оба', 'племени', 'истребили', 'друг', 'друга', 'полностью']",-77.84870939681852,-77.97038835524154
26,интересный эффект гротескной иллюзии,интересный эффект гротескной иллюзии,"['интересный', 'эффект', 'гротескной', 'иллюзии']","['интересный', 'эффект', 'гротескной', 'иллюзии']",-62.073323120374,-61.633108823192174
27,а вот чего они там таким составом делали это уже сложней,а вот чего они там таким составом делали это уже сложней,"['а', 'вот', 'чего', 'они', 'там', 'таким', 'составом', 'делали', 'это', 'уже', 'сложней']","['а', 'вот', 'чего', 'они', 'там', 'таким', 'составом', 'делали', 'это', 'уже', 'сложней']",-76.41788006974701,-76.72924644757616
28,я в российские агенства не верю,я в российские агентства не верю,"['я', 'в', 'российские', 'агенства', 'не', 'верю']","['я', 'в', 'российские', 'агентства', 'не', 'верю']",-47.3610124069012,-47.74150192338239
29,уничтоженный пожаром каменный храм восстановили своими силами в 1860 году уральские казаки,уничтоженный пожаром каменный храм восстановили своими силами в 1860 году уральские казаки,"['уничтоженный', 'пожаром', 'каменный', 'храм', 'восстановили', 'своими', 'силами', 'в', '1860', 'году', 'уральские', 'казаки']","['уничтоженный', 'пожаром', 'каменный', 'храм', 'восстановили', 'своими', 'силами', 'в', '1860', 'году', 'уральские', 'казаки']",-102.81904411980258,-103.08870578276934
30,длина 10 8 км а ширена в самом широком месте достегает 4 км,длина 10.8 км а ширина в самом широком месте достигает 4 км,"['длина', '10', '8', 'км', 'а', 'ширена', 'в', 'самом', 'широком', 'месте', 'достегает', '4', 'км']","['длина', '10.8', 'км', 'а', 'ширина', 'в', 'самом', 'широком', 'месте', 'достигает', '4', 'км']",-100.28226104049463,-89.16438822557924
31,дело и в том что белоруссия единственная постсоветская республика которая смогла переломить предначертанный ей ход событий остаться независимой и идти собственным путем,дело и в том что белоруссия единственная постсоветская республика которая смогла переломить предначертанный ей ход событий остаться независимой и идти собственным путем,"['дело', 'и', 'в', 'том', 'что', 'белоруссия', 'единственная', 'постсоветская', 'республика', 'которая', 'смогла', 'переломить', 'предначертанный', 'ей', 'ход', 'событий', 'остаться', 'независимой', 'и', 'идти', 'собственным', 'путем']","['дело', 'и', 'в', 'том', 'что', 'белоруссия', 'единственная', 'постсоветская', 'республика', 'которая', 'смогла', 'переломить', 'предначертанный', 'ей', 'ход', 'событий', 'остаться', 'независимой', 'и', 'идти', 'собственным', 'путем']",-175.18094076419115,-175.6557697998357
32,да впринципе ниче особого говорю так как есть,да в принципе ничего особого говорю так как есть,"['да', 'впринципе', 'ниче', 'особого', 'говорю', 'так', 'как', 'есть']","['да', 'в', 'принципе', 'ничего', 'особого', 'говорю', 'так', 'как', 'есть']",-77.3359665138815,-63.76884439997663
