,source,true,tokenized_source,tokenized_true,source_likelihood,true_likelihood
1487,марине 10 лет а дортуар этот в лозанне рядом с монтре где спустя полвека поселится,марине 10 лет а дортуар этот в лозанне рядом с монтре где спустя полвека поселится,"['марине', '10', 'лет', 'а', 'дортуар', 'этот', 'в', 'лозанне', 'рядом', 'с', 'монтре', 'где', 'спустя', 'полвека', 'поселится']","['марине', '10', 'лет', 'а', 'дортуар', 'этот', 'в', 'лозанне', 'рядом', 'с', 'монтре', 'где', 'спустя', 'полвека', 'поселится']",-145.10913105376474,-145.10965926118743
1488,пора бы уде свои мозги подключить к туловищу они всетаки не просто так в голове болтаются,пора бы уже свои мозги подключить к туловищу они все-таки не просто так в голове болтаются,"['пора', 'бы', 'уде', 'свои', 'мозги', 'подключить', 'к', 'туловищу', 'они', 'всетаки', 'не', 'просто', 'так', 'в', 'голове', 'болтаются']","['пора', 'бы', 'уже', 'свои', 'мозги', 'подключить', 'к', 'туловищу', 'они', 'все-таки', 'не', 'просто', 'так', 'в', 'голове', 'болтаются']",-100.88146946117656,-85.86102741733816
1489,потом заехал на гору а там 2 девченки катаются с горы на ледянках 3 часа ночи,потом заехал на гору а там 2 девчонки катаются с горы на ледянках 3 часа ночи,"['потом', 'заехал', 'на', 'гору', 'а', 'там', '2', 'девченки', 'катаются', 'с', 'горы', 'на', 'ледянках', '3', 'часа', 'ночи']","['потом', 'заехал', 'на', 'гору', 'а', 'там', '2', 'девчонки', 'катаются', 'с', 'горы', 'на', 'ледянках', '3', 'часа', 'ночи']",-111.81131173064094,-101.13534155462452
1490,а поскольку чувства у нее лишь слова в открытках надеятся на это не остается,а поскольку чувства у нее лишь слова в открытках надеяться на это не остается,"['а', 'поскольку', 'чувства', 'у', 'нее', 'лишь', 'слова', 'в', 'открытках', 'надеятся', 'на', 'это', 'не', 'остается']","['а', 'поскольку', 'чувства', 'у', 'нее', 'лишь', 'слова', 'в', 'открытках', 'надеяться', 'на', 'это', 'не', 'остается']",-103.53205733609292,-102.48669956270405
1491,мне вот предложили что-то сделать со спиной што ле,мне вот предложили что-то сделать со спиной что ли,"['мне', 'вот', 'предложили', 'что-то', 'сделать', 'со', 'спиной', 'што', 'ле']","['мне', 'вот', 'предложили', 'что-то', 'сделать', 'со', 'спиной', 'что', 'ли']",-68.34372805081208,-54.976711775650784
1492,на вопросы отвечайте коротко четко быстро,на вопросы отвечайте коротко четко быстро,"['на', 'вопросы', 'отвечайте', 'коротко', 'четко', 'быстро']","['на', 'вопросы', 'отвечайте', 'коротко', 'четко', 'быстро']",-70.64043627239397,-70.65058715134687
1493,он влюбляется в главную героиню линайну но не может даже объяснить ей и остальным своего возвышенного чувства,он влюбляется в главную героиню линайну но не может даже объяснить ей и остальным своего возвышенного чувства,"['он', 'влюбляется', 'в', 'главную', 'героиню', 'линайну', 'но', 'не', 'может', 'даже', 'объяснить', 'ей', 'и', 'остальным', 'своего', 'возвышенного', 'чувства']","['он', 'влюбляется', 'в', 'главную', 'героиню', 'линайну', 'но', 'не', 'может', 'даже', 'объяснить', 'ей', 'и', 'остальным', 'своего', 'возвышенного', 'чувства']",-117.7364159990694,-117.72821708429636
1494,ситуация был крайне серьезной но ссср опять выиграл не дрогнув,ситуация был крайне серьезной но ссср опять выиграл не дрогнув,"['ситуация', 'был', 'крайне', 'серьезной', 'но', 'ссср', 'опять', 'выиграл', 'не', 'дрогнув']","['ситуация', 'был', 'крайне', 'серьезной', 'но', 'ссср', 'опять', 'выиграл', 'не', 'дрогнув']",-105.74214874770328,-105.7473261206997
1495,пьесы не имели пророй явного сюжета а их длительность достегала 25 часов,пьесы не имели порой явного сюжета а их длительность достигала 25 часов,"['пьесы', 'не', 'имели', 'пророй', 'явного', 'сюжета', 'а', 'их', 'длительность', 'достегала', '25', 'часов']","['пьесы', 'не', 'имели', 'порой', 'явного', 'сюжета', 'а', 'их', 'длительность', 'достигала', '25', 'часов']",-136.73607224440957,-127.00104052474724
1496,потому что если у здоровых остатков русских и есть будущее то только такое,потому что если у здоровых остатков русских и есть будущее то только такое,"['потому', 'что', 'если', 'у', 'здоровых', 'остатков', 'русских', 'и', 'есть', 'будущее', 'то', 'только', 'такое']","['потому', 'что', 'если', 'у', 'здоровых', 'остатков', 'русских', 'и', 'есть', 'будущее', 'то', 'только', 'такое']",-100.19806772018315,-100.19740906043653
1497,это странно но у меня уже 3-й день начинается завтро утром или сегодня ночью,это странно но у меня уже 3-й день начинается завтра утром или сегодня ночью,"['это', 'странно', 'но', 'у', 'меня', 'уже', '3-й', 'день', 'начинается', 'завтро', 'утром', 'или', 'сегодня', 'ночью']","['это', 'странно', 'но', 'у', 'меня', 'уже', '3-й', 'день', 'начинается', 'завтра', 'утром', 'или', 'сегодня', 'ночью']",-79.82315772784773,-62.911243075592616
1498,друзья а у меня вчера родился племенник,друзья а у меня вчера родился племянник,"['друзья', 'а', 'у', 'меня', 'вчера', 'родился', 'племенник']","['друзья', 'а', 'у', 'меня', 'вчера', 'родился', 'племянник']",-53.416305947837344,-47.224031798983965
1499,хотя сама на данный момент именно к таким себя и причисляю,хотя сама на данный момент именно к таким себя и причисляю,"['хотя', 'сама', 'на', 'данный', 'момент', 'именно', 'к', 'таким', 'себя', 'и', 'причисляю']","['хотя', 'сама', 'на', 'данный', 'момент', 'именно', 'к', 'таким', 'себя', 'и', 'причисляю']",-70.71140938894145,-70.71369237499184
1500,про полет в вену сказать особо нечего полет как полет скучный и шумный,про полет в вену сказать особо нечего полет как полет скучный и шумный,"['про', 'полет', 'в', 'вену', 'сказать', 'особо', 'нечего', 'полет', 'как', 'полет', 'скучный', 'и', 'шумный']","['про', 'полет', 'в', 'вену', 'сказать', 'особо', 'нечего', 'полет', 'как', 'полет', 'скучный', 'и', 'шумный']",-124.53269189610755,-124.5187847470682
1501,когда я была маленькой я терпеть не могла оставаться ночевать у бабушки несмотря на всю мою любовь к ней,когда я была маленькой я терпеть не могла оставаться ночевать у бабушки несмотря на всю мою любовь к ней,"['когда', 'я', 'была', 'маленькой', 'я', 'терпеть', 'не', 'могла', 'оставаться', 'ночевать', 'у', 'бабушки', 'несмотря', 'на', 'всю', 'мою', 'любовь', 'к', 'ней']","['когда', 'я', 'была', 'маленькой', 'я', 'терпеть', 'не', 'могла', 'оставаться', 'ночевать', 'у', 'бабушки', 'несмотря', 'на', 'всю', 'мою', 'любовь', 'к', 'ней']",-74.57952797756238,-74.57963258596854
1502,у меня есть песенка элтона и тимбаленда из этого несостоявшегося альбома,у меня есть песенка элтона и тимбаленда из этого несостоявшегося альбома,"['у', 'меня', 'есть', 'песенка', 'элтона', 'и', 'тимбаленда', 'из', 'этого', 'несостоявшегося', 'альбома']","['у', 'меня', 'есть', 'песенка', 'элтона', 'и', 'тимбаленда', 'из', 'этого', 'несостоявшегося', 'альбома']",-81.1879152049185,-81.18808967968971
1503,нужна помощь крепких мальчиков может если побольше будет народу,нужна помощь крепких мальчиков может если побольше будет народу,"['нужна', 'помощь', 'крепких', 'мальчиков', 'может', 'если', 'побольше', 'будет', 'народу']","['нужна', 'помощь', 'крепких', 'мальчиков', 'может', 'если', 'побольше', 'будет', 'народу']",-91.13823332932243,-91.1235620075921
1504,может не стоит привадить столь топорные сравнения а надо просто начать плавать,может не стоит приводить столь топорные сравнения а надо просто начать плавать,"['может', 'не', 'стоит', 'привадить', 'столь', 'топорные', 'сравнения', 'а', 'надо', 'просто', 'начать', 'плавать']","['может', 'не', 'стоит', 'приводить', 'столь', 'топорные', 'сравнения', 'а', 'надо', 'просто', 'начать', 'плавать']",-120.62669522669565,-110.55770114014395
1505,если в жизне иногда случаеться чтото что может закончиться плохо я всегда старалась убеждать себя в том что всеее будет хорошо и так оно всегда и было,если в жизни иногда случается что-то что может закончиться плохо я всегда старалась убеждать себя в том что все будет хорошо и так оно всегда и было,"['если', 'в', 'жизне', 'иногда', 'случаеться', 'чтото', 'что', 'может', 'закончиться', 'плохо', 'я', 'всегда', 'старалась', 'убеждать', 'себя', 'в', 'том', 'что', 'всеее', 'будет', 'хорошо', 'и', 'так', 'оно', 'всегда', 'и', 'было']","['если', 'в', 'жизни', 'иногда', 'случается', 'что-то', 'что', 'может', 'закончиться', 'плохо', 'я', 'всегда', 'старалась', 'убеждать', 'себя', 'в', 'том', 'что', 'все', 'будет', 'хорошо', 'и', 'так', 'оно', 'всегда', 'и', 'было']",-154.99939034600118,-93.96301951833205
1506,да и нет никакой ясности в том что человеку нужна для этой условно говоря устойчивости,да и нет никакой ясности в том что человеку нужна для этой условно говоря устойчивости,"['да', 'и', 'нет', 'никакой', 'ясности', 'в', 'том', 'что', 'человеку', 'нужна', 'для', 'этой', 'условно', 'говоря', 'устойчивости']","['да', 'и', 'нет', 'никакой', 'ясности', 'в', 'том', 'что', 'человеку', 'нужна', 'для', 'этой', 'условно', 'говоря', 'устойчивости']",-106.94797825623664,-106.5471457669693
1507,вечер же обежал быть не только приятным но много обещающим,вечер же обещал быть не только приятным но многообещающим,"['вечер', 'же', 'обежал', 'быть', 'не', 'только', 'приятным', 'но', 'много', 'обещающим']","['вечер', 'же', 'обещал', 'быть', 'не', 'только', 'приятным', 'но', 'многообещающим']",-113.35682513336903,-74.98206652725568
1508,поэтому он сам становится посредником в нашей молитве и как бы говорит нам идите к отцу вот краски кисти и холст каково смотреть на то что выходит из всего этого,поэтому он сам становится посредником в нашей молитве и как бы говорит нам идите к отцу вот краски кисти и холст каково смотреть на то что выходит из всего этого,"['поэтому', 'он', 'сам', 'становится', 'посредником', 'в', 'нашей', 'молитве', 'и', 'как', 'бы', 'говорит', 'нам', 'идите', 'к', 'отцу', 'вот', 'краски', 'кисти', 'и', 'холст', 'каково', 'смотреть', 'на', 'то', 'что', 'выходит', 'из', 'всего', 'этого']","['поэтому', 'он', 'сам', 'становится', 'посредником', 'в', 'нашей', 'молитве', 'и', 'как', 'бы', 'говорит', 'нам', 'идите', 'к', 'отцу', 'вот', 'краски', 'кисти', 'и', 'холст', 'каково', 'смотреть', 'на', 'то', 'что', 'выходит', 'из', 'всего', 'этого']",-185.09418944340013,-185.09109847835487
1509,и те кто живут со мной уже просто не обращают на это внимания,и те кто живут со мной уже просто не обращают на это внимания,"['и', 'те', 'кто', 'живут', 'со', 'мной', 'уже', 'просто', 'не', 'обращают', 'на', 'это', 'внимания']","['и', 'те', 'кто', 'живут', 'со', 'мной', 'уже', 'просто', 'не', 'обращают', 'на', 'это', 'внимания']",-53.18358964319294,-53.19416204067792
1510,мне вынесло моск после прочитаного,мне вынесло мозг после прочитанного,"['мне', 'вынесло', 'моск', 'после', 'прочитаного']","['мне', 'вынесло', 'мозг', 'после', 'прочитанного']",-65.3143298925998,-50.953567207795665
1511,а в июле этого года в бухаресте с целью установления подлинности останков была проведена эксгумация коммунистического диктатора николае чаушеску и его супруги елены,а в июле этого года в бухаресте с целью установления подлинности останков была проведена эксгумация коммунистического диктатора николае чаушеску и его супруги елены,"['а', 'в', 'июле', 'этого', 'года', 'в', 'бухаресте', 'с', 'целью', 'установления', 'подлинности', 'останков', 'была', 'проведена', 'эксгумация', 'коммунистического', 'диктатора', 'николае', 'чаушеску', 'и', 'его', 'супруги', 'елены']","['а', 'в', 'июле', 'этого', 'года', 'в', 'бухаресте', 'с', 'целью', 'установления', 'подлинности', 'останков', 'была', 'проведена', 'эксгумация', 'коммунистического', 'диктатора', 'николае', 'чаушеску', 'и', 'его', 'супруги', 'елены']",-187.78080130814195,-187.78651255455745
1512,неужели у меня всне так плохо а знаеш мона просто квадрат малевича забахать как те,неужели у меня все так плохо а знаешь можно просто квадрат малевича забахать как тебе,"['неужели', 'у', 'меня', 'всне', 'так', 'плохо', 'а', 'знаеш', 'мона', 'просто', 'квадрат', 'малевича', 'забахать', 'как', 'те']","['неужели', 'у', 'меня', 'все', 'так', 'плохо', 'а', 'знаешь', 'можно', 'просто', 'квадрат', 'малевича', 'забахать', 'как', 'тебе']",-165.48261499894016,-123.05619442525997
1513,по данным российской газеты не исключается что у подозреваемого есть сообщник среди сотрудников спецслужб,по данным российской газеты не исключается что у подозреваемого есть сообщник среди сотрудников спецслужб,"['по', 'данным', 'российской', 'газеты', 'не', 'исключается', 'что', 'у', 'подозреваемого', 'есть', 'сообщник', 'среди', 'сотрудников', 'спецслужб']","['по', 'данным', 'российской', 'газеты', 'не', 'исключается', 'что', 'у', 'подозреваемого', 'есть', 'сообщник', 'среди', 'сотрудников', 'спецслужб']",-83.87499058397944,-83.64941869635705
1514,я ей в кратце пересказала свою биографию за последнее десятилетие она осталась довольна,я ей вкратце пересказала свою биографию за последнее десятилетие она осталась довольна,"['я', 'ей', 'в', 'кратце', 'пересказала', 'свою', 'биографию', 'за', 'последнее', 'десятилетие', 'она', 'осталась', 'довольна']","['я', 'ей', 'вкратце', 'пересказала', 'свою', 'биографию', 'за', 'последнее', 'десятилетие', 'она', 'осталась', 'довольна']",-90.69883836719416,-94.092241852428
1515,что то както слишком много работы стало или мне нужен отпуск,что-то как-то слишком много работы стало или мне нужен отпуск,"['что', 'то', 'както', 'слишком', 'много', 'работы', 'стало', 'или', 'мне', 'нужен', 'отпуск']","['что-то', 'как-то', 'слишком', 'много', 'работы', 'стало', 'или', 'мне', 'нужен', 'отпуск']",-74.78329256960366,-70.10321481109891
1516,другая немецкая газета augsburger allgemeine zeitung сообщила что абрамович нанял очень дорого повара,другая немецкая газета augsburger allgemeine zeitung сообщила что абрамович нанял очень дорогого повара,"['другая', 'немецкая', 'газета', 'augsburger', 'allgemeine', 'zeitung', 'сообщила', 'что', 'абрамович', 'нанял', 'очень', 'дорого', 'повара']","['другая', 'немецкая', 'газета', 'augsburger', 'allgemeine', 'zeitung', 'сообщила', 'что', 'абрамович', 'нанял', 'очень', 'дорогого', 'повара']",-139.0301337846416,-134.85127244847828
1517,отец уехал некоторые документы поручил мне развести сказал что там отвозить нечего ниче страшного не сломаешься ну я естественно тянула это все как всегда вообщем то до последнего,отец уехал некоторые документы поручил мне развезти сказал что там отвозить нечего ничего страшного не сломаешься ну я естественно тянула это все как всегда в общем-то до последнего,"['отец', 'уехал', 'некоторые', 'документы', 'поручил', 'мне', 'развести', 'сказал', 'что', 'там', 'отвозить', 'нечего', 'ниче', 'страшного', 'не', 'сломаешься', 'ну', 'я', 'естественно', 'тянула', 'это', 'все', 'как', 'всегда', 'вообщем', 'то', 'до', 'последнего']","['отец', 'уехал', 'некоторые', 'документы', 'поручил', 'мне', 'развезти', 'сказал', 'что', 'там', 'отвозить', 'нечего', 'ничего', 'страшного', 'не', 'сломаешься', 'ну', 'я', 'естественно', 'тянула', 'это', 'все', 'как', 'всегда', 'в', 'общем-то', 'до', 'последнего']",-232.1098980269983,-240.63442218858117
1518,кожа сухая как полседний осенний лист в свете холодного ноябрьского света котрый даже дожди уже не могут напоить влагой,кожа сухая как последний осенний лист в свете холодного ноябрьского света который даже дожди уже не могут напоить влагой,"['кожа', 'сухая', 'как', 'полседний', 'осенний', 'лист', 'в', 'свете', 'холодного', 'ноябрьского', 'света', 'котрый', 'даже', 'дожди', 'уже', 'не', 'могут', 'напоить', 'влагой']","['кожа', 'сухая', 'как', 'последний', 'осенний', 'лист', 'в', 'свете', 'холодного', 'ноябрьского', 'света', 'который', 'даже', 'дожди', 'уже', 'не', 'могут', 'напоить', 'влагой']",-176.697859352748,-162.15299675572845
1519,с такими же результатами закончился и мой эксперемент 2 года назад,с такими же результатами закончился и мой эксперимент 2 года назад,"['с', 'такими', 'же', 'результатами', 'закончился', 'и', 'мой', 'эксперемент', '2', 'года', 'назад']","['с', 'такими', 'же', 'результатами', 'закончился', 'и', 'мой', 'эксперимент', '2', 'года', 'назад']",-67.93903106378193,-64.15542199828658
